{
  "timestamp": "2025-10-03T19:55:49.355515",
  "data_source": "DolarAPI",
  "cotizations_analysis": {
    "total_cotizations": 7,
    "cotizations": [
      {
        "moneda": "USD",
        "casa": "oficial",
        "nombre": "Oficial",
        "compra": 1400,
        "venta": 1450,
        "fechaActualizacion": "2025-10-03T17:01:00.000Z"
      },
      {
        "moneda": "USD",
        "casa": "blue",
        "nombre": "Blue",
        "compra": 1420,
        "venta": 1440,
        "fechaActualizacion": "2025-10-03T21:00:00.000Z"
      },
      {
        "moneda": "USD",
        "casa": "bolsa",
        "nombre": "Bolsa",
        "compra": 1497.4,
        "venta": 1510.6,
        "fechaActualizacion": "2025-10-03T21:00:00.000Z"
      },
      {
        "moneda": "USD",
        "casa": "contadoconliqui",
        "nombre": "Contado con liquidación",
        "compra": 1520.2,
        "venta": 1522.9,
        "fechaActualizacion": "2025-10-03T21:00:00.000Z"
      },
      {
        "moneda": "USD",
        "casa": "mayorista",
        "nombre": "Mayorista",
        "compra": 1415.5,
        "venta": 1424.5,
        "fechaActualizacion": "2025-10-03T15:52:00.000Z"
      },
      {
        "moneda": "USD",
        "casa": "cripto",
        "nombre": "Cripto",
        "compra": 1514,
        "venta": 1520,
        "fechaActualizacion": "2025-10-03T21:00:00.000Z"
      },
      {
        "moneda": "USD",
        "casa": "tarjeta",
        "nombre": "Tarjeta",
        "compra": 1820,
        "venta": 1885,
        "fechaActualizacion": "2025-10-03T17:01:00.000Z"
      }
    ],
    "analysis": "Aquí tienes un análisis detallado de las cotizaciones del dólar en Argentina proporcionadas por DolarAPI:\n\n## Análisis Detallado de Cotizaciones del Dólar en Argentina\n\nA continuación, se presenta un análisis de las diferentes cotizaciones del dólar presentadas, incluyendo su interpretación, diferencias, factores influyentes, implicaciones y recomendaciones.\n\n---\n\n### 1. Interpretación de Cada Tipo de Cotización\n\n*   **Dólar Oficial:**\n    *   **Interpretación:** Es la cotización establecida por el Banco Central de la República Argentina (BCRA) y los bancos comerciales. Es el tipo de cambio utilizado para operaciones de comercio exterior (importaciones y exportaciones), pagos de deudas externas y algunas transacciones reguladas.\n    *   **Valores:** Compra: 1400 ARS, Venta: 1450 ARS.\n    *   **Fecha:** 2025-10-03T17:01:00.000Z\n\n*   **Dólar Blue (o Paralelo):**\n    *   **Interpretación:** Es el tipo de cambio que se negocia en el mercado informal, generalmente a través de casas de cambio no autorizadas o \"cuevas\". Refleja la oferta y demanda de dólares fuera del circuito formal y a menudo se ve influenciado por la desconfianza en la economía y la demanda de cobertura.\n    *   **Valores:** Compra: 1420 ARS, Venta: 1440 ARS.\n    *   **Fecha:** 2025-10-03T21:00:00.000Z\n\n*   **Dólar Bolsa (o MEP - Mercado de Pases):**\n    *   **Interpretación:** Se obtiene a través de la compra y venta de títulos valores (como acciones o bonos) que cotizan tanto en pesos como en dólares. Permite comprar dólares \"en blanco\" mediante una operación bursátil, evitando regulaciones del mercado oficial.\n    *   **Valores:** Compra: 1497.4 ARS, Venta: 1510.6 ARS.\n    *   **Fecha:** 2025-10-03T21:00:00.000Z\n\n*   **Contado con Liquidación (COLCAP):**\n    *   **Interpretación:** Similar al Dólar Bolsa, pero implica la compra de un activo en pesos y su posterior venta en el exterior (generalmente en Nueva York) contra dólares. Es una forma de girar divisas al exterior o adquirir dólares \"en blanco\" para atesoramiento o inversión.\n    *   **Valores:** Compra: 1520.2 ARS, Venta: 1522.9 ARS.\n    *   **Fecha:** 2025-10-03T21:00:00.000Z\n\n*   **Dólar Mayorista:**\n    *   **Interpretación:** Es el tipo de cambio utilizado en operaciones de gran volumen entre entidades financieras y grandes empresas. Generalmente, sigue de cerca al dólar oficial pero puede tener una ligera diferencia debido a las negociaciones interbancarias.\n    *   **Valores:** Compra: 1415.5 ARS, Venta: 1424.5 ARS.\n    *   **Fecha:** 2025-10-03T15:52:00.000Z\n\n*   **Dólar Cripto:**\n    *   **Interpretación:** Es el tipo de cambio implícito en las operaciones de compra y venta de criptomonedas (como stablecoins atadas al dólar) en exchanges locales. Refleja la oferta y demanda de estas divisas digitales en el mercado argentino.\n    *   **Valores:** Compra: 1514 ARS, Venta: 1520 ARS.\n    *   **Fecha:** 2025-10-03T21:00:00.000Z\n\n*   **Dólar Tarjeta (o Dólar Turista):**\n    *   **Interpretación:** Se aplica a las compras realizadas en el exterior con tarjetas de crédito y débito. Históricamente, este tipo de cambio incluía impuestos y percepciones que lo hacían significativamente más alto que el oficial. En este caso, los valores sugieren que podría estar incorporando algún tipo de recargo o ser una cotización oficial con impuestos añadidos.\n    *   **Valores:** Compra: 1820 ARS, Venta: 1885 ARS.\n    *   **Fecha:** 2025-10-03T17:01:00.000Z\n\n---\n\n### 2. Diferencias entre las Cotizaciones y su Significado\n\nLa principal diferencia radica en el **mercado** donde operan, las **regulaciones** que las afectan y los **agentes** que participan.\n\n*   **Oficial vs. Blue:** El oficial está regulado por el BCRA, mientras que el blue opera en el mercado negro. La diferencia (brecha) entre ambos suele ser un indicador de la tensión cambiaria, la demanda de ahorro en dólares y la desconfianza en la política económica.\n    *   En este caso: Oficial (Venta: 1450) vs. Blue (Venta: 1440). Sorprendentemente, el dólar blue está *más bajo* que el oficial, lo cual es una situación atípica y podría indicar una sobreoferta puntual de dólares en el mercado informal o una intervención para achicar la brecha.\n\n*   **Oficial vs. Bolsas/Contado con Liquidación:** Estos dólares son \"legales\" pero accesibles a través de operaciones financieras. Suelen estar por encima del oficial (lo que se conoce como \"brecha financiera\") debido a las restricciones cambiarias para acceder al dólar oficial y la demanda de divisas para ahorro e inversión.\n    *   En este caso:\n        *   Dólar Oficial (Venta: 1450)\n        *   Dólar Bolsa (Venta: 1510.6) - Diferencia de +60.6 ARS (+4.18%)\n        *   Contado con Liquidación (Venta: 1522.9) - Diferencia de +72.9 ARS (+5.03%)\n    *   La diferencia entre Bolsa y CCL suele ser menor, indicando que ambos son mecanismos para hacerse de dólares en blanco a un tipo de cambio superior al oficial.\n\n*   **Mayorista vs. Oficial:** El mayorista suele ser ligeramente inferior al oficial de venta, ya que es el precio base para transacciones entre bancos y grandes participantes.\n    *   En este caso: Mayorista (Venta: 1424.5) vs. Oficial (Venta: 1450). El mayorista está por debajo del oficial, lo cual es lo esperable.\n\n*   **Blue vs. Cripto:** Ambos reflejan mercados más libres que el oficial. Suelen estar cerca entre sí.\n    *   En este caso: Blue (Venta: 1440) vs. Cripto (Venta: 1520). Aquí hay una diferencia notable (80 ARS), donde el dólar cripto está significativamente más caro. Esto podría deberse a una mayor demanda de stablecoins en ese momento o a la dificultad de arbitraje.\n\n*   **Todos vs. Tarjeta:** El dólar tarjeta es consistentemente el más alto, reflejando impuestos y recargos aplicados sobre el tipo de cambio, además de la cotización en sí.\n    *   En este caso: Tarjeta (Venta: 1885) vs. Oficial (Venta: 1450). Es un 30% más caro que el oficial.\n\n---\n\n### 3. Factores que Influyen en Cada Tipo de Cotización\n\n*   **Dólar Oficial:**\n    *   **Política Monetaria y Cambiaria:** Decisiones del BCRA sobre tasas de interés, intervención en el mercado, límites a la compra de divisas.\n    *   **Nivel de Reservas Internacionales:** La disponibilidad de divisas para intervenir y sostener el tipo de cambio.\n    *   **Balanza Comercial:** El saldo exportaciones-importaciones. Un superávit tiende a apreciarlo, un déficit a depreciarlo.\n    *   **Inflación:** La alta inflación local presiona a la devaluación para mantener la competitividad.\n\n*   **Dólar Blue:**\n    *   **Demanda de Cobertura:** Mayor demanda de ahorristas que buscan protegerse de la inflación y la devaluación.\n    *   **Desconfianza Económica y Política:** Incertidumbre sobre el futuro económico y las políticas del gobierno.\n    *   **Oferta Limitada:** Depende de la liquidez que ingresa al mercado informal (ej. exportaciones no declaradas, remesas de argentinos en el exterior).\n    *   **Expectativas:** Percepciones sobre la futura evolución del dólar oficial y la economía.\n    *   **Controles Cambiarios:** Las restricciones al acceso al dólar oficial aumentan la demanda del informal.\n\n*   **Dólar Bolsa y Contado con Liquidación:**\n    *   **Restricciones al Acceso al Dólar Oficial:** Cuanto más difícil sea comprar dólar oficial, mayor será la demanda de estos canales.\n    *   **Inversiones y Desinversiones:** Flujos de capitales que compran o venden activos en dólares.\n    *   **Regulaciones Financieras:** Límites y normativas impuestas por la CNV y el BCRA sobre operaciones bursátiles.\n    *   **Condiciones del Mercado Internacional:** Tasas de interés globales, riesgo país.\n\n*   **Dólar Mayorista:**\n    *   **Operaciones de Comercio Exterior:** Principalmente para liquidación de divisas por exportaciones e importaciones.\n    *   **Acuerdos entre Entidades Financieras:** Refleja el precio para transacciones a gran escala.\n\n*   **Dólar Cripto:**\n    *   **Demanda de Stablecoins:** Interés en usar criptomonedas como reserva de valor o medio de pago/transferencia.\n    *   **Liquidez en Exchanges:** Disponibilidad de dólares y pesos en las plataformas de intercambio.\n    *   **Arbitraje:** Diferencias de precios con otros mercados (blue, bolsa).\n\n*   **Dólar Tarjeta:**\n    *   **Políticas Fiscales:** Impuestos y percepciones (ej. Impuesto PAIS, adelantos de Ganancias/Bienes Personales).\n    *   **Tipo de Cambio de Referencia:** Se basa en una cotización oficial o de mercado específica que se define en el momento de la operación.\n    *   **Objetivos del Gobierno:** A veces se utiliza para desalentar el consumo en el exterior o para recaudar.\n\n---\n\n### 4. Implicaciones para Diferentes Tipos de Usuarios\n\n*   **Inversores:**\n    *   **Buscan Cobertura/Renta:** Los dólares Bolsa, Contado con Liquidación y Cripto son opciones para resguardar el valor o buscar rendimientos, ya que operan a precios de mercado y son \"en blanco\".\n    *   **Oportunidades de Arbitraje:** La diferencia entre los distintos tipos de cambio puede generar oportunidades para quienes sepan aprovecharlas (ej. comprar dólar blue y vender vía CCL, o viceversa).\n    *   **Riesgo Cambiario:** Deben considerar la volatilidad de cada cotización y las posibles intervenciones o cambios regulatorios.\n\n*   **Empresas:**\n    *   **Importadores:** Necesitan acceder al dólar oficial o mayorista para pagos de importaciones, pero las restricciones pueden obligarlos a recurrir a cotizaciones más caras.\n    *   **Exportadores:** Liquidar divisas al tipo de cambio oficial o mayorista es lo más común, pero podrían tener incentivos para liquidar en el mercado libre si las brechas son muy amplias.\n    *   **Empresas con Deuda en Dólares:** La diferencia entre las cotizaciones impacta directamente en el costo de pago de sus obligaciones.\n    *   **Empresas que Operan en el Exterior:** Necesitan acceso a Contado con Liquidación para girar fondos o pagar servicios en el exterior.\n\n*   **Consumidores:**\n    *   **Ahorristas:** El dólar blue es la opción más accesible para quienes quieren comprar billetes físicos para ahorro, aunque en este caso esté más bajo que el oficial.\n    *   **Viajeros:** El dólar tarjeta es el que afecta directamente sus gastos en el exterior. Cuanto más alto, más caros serán los viajes y consumos.\n    *   **Consumo Interno:** Los precios de bienes y servicios importados suelen estar influenciados por las cotizaciones más altas (bolsa, CCL, tarjeta), generando inflación.\n    *   **Acceso a Divisas:** La diferencia de precio entre el oficial y el blue genera una barrera para quienes no pueden acceder al primero y no quieren o no pueden operar en el mercado informal.\n\n---\n\n### 5. Recomendaciones Específicas para Cada Tipo de Cotización\n\n*   **Dólar Oficial:**\n    *   **Para Empresas:** Priorizar el uso para importaciones esenciales y exportaciones, aprovechando la menor cotización. Monitorear de cerca las regulaciones.\n    *   **Para Individuos:** Acceder solo si hay una necesidad específica y se cumplen los requisitos (ej. por alguna regulación particular). No es una opción de ahorro o inversión.\n\n*   **Dólar Blue:**\n    *   **Para Consumidores/Ahorristas:** Dada la inusual situación de estar por debajo del oficial, podría ser una oportunidad para quienes buscan comprar dólares físicos, pero siempre con cautela y priorizando la seguridad en la transacción.\n    *   **Para Inversores:** Menos atractivo para inversión financiera, más para tenencia física.\n\n*   **Dólar Bolsa y Contado con Liquidación:**\n    *   **Para Inversores y Empresas:** Canales recomendados para dolarización de ahorros o inversión en activos financieros. Permiten operar \"en blanco\". Es crucial operar con intermediarios regulados (brokers).\n    *   **Monitoreo:** Vigilar la brecha financiera y las regulaciones que puedan afectar estas operaciones.\n\n*   **Dólar Mayorista:**\n    *   **Para Empresas:** Utilizar para operaciones de comercio exterior y pago a proveedores internacionales, donde sea aplicable.\n\n*   **Dólar Cripto:**\n    *   **Para Inversores y Usuarios de Cripto:** Opción práctica para acceder a stablecoins. Evaluar la confiabilidad del exchange y los riesgos inherentes a las criptomonedas.\n    *   **Comparación:** Comparar siempre con otros tipos de cambio para determinar si es conveniente en un momento dado. En este caso, parece más caro que el blue.\n\n*   **Dólar Tarjeta:**\n    *   **Para Consumidores:** Considerar los gastos en el exterior como más caros. Buscar alternativas si es posible (ej. prepagas, efectivo).\n    *   **Monitoreo:** Estar al tanto de posibles cambios en impuestos o el tipo de cambio de referencia que lo componen.\n\n---\n\n**Consideraciones Generales:**\n\n*   **Volatilidad:** El mercado de divisas en Argentina es altamente volátil. Las cotizaciones pueden cambiar rápidamente.\n*   **Brecha Cambiaria:** La diferencia entre el dólar oficial y los paralelos (blue, bolsa, CCL) es un indicador clave de la salud económica y la confianza. En este escenario, la brecha \"blue vs. oficial\" es negativa, lo cual es muy atípico. La brecha \"financiera\" (Bolsa/CCL vs. Oficial) sigue siendo positiva y significativa.\n*   **Regulaciones:** Las políticas gubernamentales pueden modificar drásticamente el acceso y el costo de cada tipo de dólar.\n\nEste análisis proporciona una visión general de las cotizaciones. Las decisiones de inversión, ahorro o negocio deben basarse en una evaluación continua del contexto económico y financiero.\n\nTERMINATE"
  },
  "gaps_analysis": {
    "oficial_cotization": {
      "moneda": "USD",
      "casa": "oficial",
      "nombre": "Oficial",
      "compra": 1400,
      "venta": 1450,
      "fechaActualizacion": "2025-10-03T17:01:00.000Z"
    },
    "gaps": {
      "blue": {
        "gap_percentage": -0.69,
        "gap_amount": -10,
        "cotization": {
          "moneda": "USD",
          "casa": "blue",
          "nombre": "Blue",
          "compra": 1420,
          "venta": 1440,
          "fechaActualizacion": "2025-10-03T21:00:00.000Z"
        }
      },
      "bolsa": {
        "gap_percentage": 4.18,
        "gap_amount": 60.6,
        "cotization": {
          "moneda": "USD",
          "casa": "bolsa",
          "nombre": "Bolsa",
          "compra": 1497.4,
          "venta": 1510.6,
          "fechaActualizacion": "2025-10-03T21:00:00.000Z"
        }
      },
      "contadoconliqui": {
        "gap_percentage": 5.03,
        "gap_amount": 72.9,
        "cotization": {
          "moneda": "USD",
          "casa": "contadoconliqui",
          "nombre": "Contado con liquidación",
          "compra": 1520.2,
          "venta": 1522.9,
          "fechaActualizacion": "2025-10-03T21:00:00.000Z"
        }
      },
      "mayorista": {
        "gap_percentage": -1.76,
        "gap_amount": -25.5,
        "cotization": {
          "moneda": "USD",
          "casa": "mayorista",
          "nombre": "Mayorista",
          "compra": 1415.5,
          "venta": 1424.5,
          "fechaActualizacion": "2025-10-03T15:52:00.000Z"
        }
      },
      "cripto": {
        "gap_percentage": 4.83,
        "gap_amount": 70,
        "cotization": {
          "moneda": "USD",
          "casa": "cripto",
          "nombre": "Cripto",
          "compra": 1514,
          "venta": 1520,
          "fechaActualizacion": "2025-10-03T21:00:00.000Z"
        }
      },
      "tarjeta": {
        "gap_percentage": 30.0,
        "gap_amount": 435,
        "cotization": {
          "moneda": "USD",
          "casa": "tarjeta",
          "nombre": "Tarjeta",
          "compra": 1820,
          "venta": 1885,
          "fechaActualizacion": "2025-10-03T17:01:00.000Z"
        }
      }
    },
    "analysis": "Aquí tienes un análisis detallado de las brechas cambiarias en Argentina basado en los datos proporcionados:\n\n## Análisis de Brechas Cambiarias en Argentina\n\nLas brechas cambiarias representan las diferencias entre los diversos tipos de cambio del dólar en Argentina. Estas diferencias son indicadores clave de la segmentación del mercado, las restricciones, las expectativas y la salud general de la economía. En este análisis, tomaremos la **Cotización Oficial de Venta (1450 ARS)** como referencia principal para interpretar las brechas, a menos que se especifique lo contrario.\n\n---\n\n### 1. Interpretación de las Brechas Cambiarias\n\nLas brechas calculadas muestran:\n\n*   **Dólar Blue:**\n    *   **Brecha:** -10 ARS (Venta: 1440)\n    *   **Interpretación:** La brecha es **negativa (-0.69%)**. Esto significa que el dólar blue se está cotizando *por debajo* del dólar oficial de venta. Esta es una situación atípica y sugiere una oferta inusual de dólares en el mercado informal o una demanda muy débil, al punto de que el precio es inferior al oficial. Tradicionalmente, el blue opera por encima del oficial.\n\n*   **Dólar Bolsa (MEP):**\n    *   **Brecha:** +60.6 ARS (Venta: 1510.6)\n    *   **Interpretación:** La brecha es **positiva (4.18%)**. El dólar bolsa se negocia por encima del oficial, indicando que se necesitan más pesos para comprar un dólar a través de este mecanismo financiero regulado. Esto es lo esperado cuando hay restricciones para acceder al dólar oficial.\n\n*   **Contado con Liquidación (COLCAP):**\n    *   **Brecha:** +72.9 ARS (Venta: 1522.9)\n    *   **Interpretación:** La brecha es **positiva (5.03%)**. Similar al dólar bolsa, el COLCAP opera por encima del oficial. La diferencia entre el COLCAP y el Bolsa suele ser pequeña, reflejando la facilidad relativa para acceder a divisas en blanco a través de ambos mecanismos.\n\n*   **Dólar Mayorista:**\n    *   **Brecha:** -25.5 ARS (Venta: 1424.5)\n    *   **Interpretación:** La brecha es **negativa (-1.76%)**. El dólar mayorista (el precio interbancario) está por debajo del oficial de venta. Esto es esperable, ya que el dólar oficial de venta suele ser un punto de referencia que incorpora un margen, y el mayorista representa un precio base para transacciones entre grandes entidades.\n\n*   **Dólar Cripto:**\n    *   **Brecha:** +70 ARS (Venta: 1520)\n    *   **Interpretación:** La brecha es **positiva (4.83%)**. El dólar cripto se cotiza por encima del oficial. Su cercanía al dólar bolsa y COLCAP es común, ya que ambos reflejan el precio de mercado sin las regulaciones directas del oficial.\n\n*   **Dólar Tarjeta:**\n    *   **Brecha:** +435 ARS (Venta: 1885)\n    *   **Interpretación:** La brecha es **extremadamente positiva (30.0%)**. El dólar tarjeta, que incluye impuestos y recargos, es significativamente más caro que el oficial. Esta brecha tan amplia tiene un propósito disuasorio para el consumo en el exterior y/o de recaudación fiscal.\n\n---\n\n### 2. Factores que Generan Estas Diferencias\n\n*   **Regulaciones y Controles Cambiarios:** La principal causa de las brechas positivas (Bolsa, CCL, Cripto, Tarjeta) es la existencia de un mercado oficial con acceso limitado. Los controles dificultan la compra de divisas en el mercado oficial, obligando a quienes necesitan dólares a recurrir a otros canales, pagando un precio mayor.\n*   **Oferta y Demanda en Mercados Segmentados:**\n    *   **Mercado Oficial:** Restringido, con acceso limitado por cupos o requisitos específicos.\n    *   **Mercado Blue:** Informal, su oferta y demanda dependen de factores como la liquidación de exportaciones no declaradas, remesas y demanda de ahorro físico. La actual brecha negativa sugiere una sobreoferta o baja demanda puntual.\n    *   **Mercado Financiero (Bolsa/CCL):** Influenciado por la demanda de inversión, cobertura y girar fondos al exterior, así como por la oferta de liquidación de exportaciones.\n    *   **Mercado Cripto:** Impulsado por la demanda de stablecoins como reserva de valor o medio de pago alternativo, y la liquidez en exchanges.\n    *   **Mercado Mayorista:** Determinado por las transacciones de grandes volúmenes entre entidades.\n*   **Expectativas y Confianza:** La percepción sobre la futura estabilidad económica, la inflación y las políticas del gobierno influyen fuertemente en la demanda de dólares en los mercados paralelos y financieros. Una alta desconfianza tiende a disparar las brechas positivas.\n*   **Impuestos y Percepciones:** El dólar tarjeta es el claro ejemplo de cómo la carga impositiva dispara la brecha, haciendo que el costo para el consumidor sea mucho mayor que la cotización base.\n*   **Intervención Oficial:** El BCRA puede intervenir en los mercados para influir en las cotizaciones y achicar las brechas, aunque su efectividad varía.\n\n---\n\n### 3. Impacto Económico de las Brechas\n\n*   **Inflación:** Las brechas positivas (Bolsa, CCL, Cripto, Tarjeta) actúan como un ancla de precios para una porción importante de la economía. Los bienes y servicios importados o vinculados a la cotización de estos dólares verán sus precios reflejar estas diferencias, alimentando la inflación.\n*   **Distorsiones en la Asignación de Recursos:** Las diferentes cotizaciones generan arbitrajes y desincentivan actividades económicas. Por ejemplo, un exportador puede preferir liquidar sus divisas por el canal que le ofrezca la mejor cotización, y un importador puede enfrentar costos muy dispares según el acceso al dólar.\n*   **Desincentivo a la Inversión Productiva:** La volatilidad de las brechas y la incertidumbre asociada pueden desalentar inversiones productivas de largo plazo, fomentando la especulación financiera.\n*   **Pérdida de Poder Adquisitivo:** Para quienes no tienen acceso a dólares más baratos, la brecha amplía la brecha entre sus ingresos en pesos y el costo de bienes y servicios, especialmente los importados.\n*   **Mercado Informal:** La brecha negativa del dólar blue, si se mantiene, puede desincentivar la liquidación formal de exportaciones menores y fomentar el mercado negro, o ser una señal de alerta sobre la liquidez en el sistema financiero.\n*   **Ingreso de Divisas al País:** Las brechas altas pueden incentivar la liquidación de exportaciones en el mercado oficial si se implementan medidas para achicarlas, o bien, fomentar el ingreso de divisas a través de los canales financieros.\n\n---\n\n### 4. Perspectivas sobre la Convergencia o Divergencia\n\n*   **Convergencia:**\n    *   **Posibilidad:** Si el gobierno implementa políticas macroeconómicas consistentes y genera confianza (ej. reducción de déficit fiscal, ordenamiento monetario, unificación cambiaria), se esperaría una convergencia hacia un tipo de cambio único o con brechas muy pequeñas.\n    *   **Factores Clave:** Eliminación de restricciones, superávit fiscal sostenible, aumento de reservas, baja de inflación.\n\n*   **Divergencia:**\n    *   **Posibilidad:** Si las condiciones económicas empeoran, la inflación sigue alta, el déficit fiscal se mantiene y las restricciones se endurecen, las brechas tenderán a ampliarse, especialmente las financieras y la del dólar tarjeta.\n    *   **Factores Clave:** Falta de acuerdos políticos, emisión monetaria, shocks externos negativos, crisis de confianza.\n\n*   **Situación Actual (con brecha azul negativa):** La brecha azul negativa es una anomalía. Podría ser temporal y revertirse rápidamente, volviendo a operar por encima del oficial. Si se mantiene, podría indicar un cambio estructural o una señal de alerta sobre la salud del mercado informal. Las brechas financieras (Bolsa/CCL) permanecen positivas, lo que sugiere que las restricciones al acceso oficial siguen vigentes y generan un \"premium\" para quienes operan por fuera de ese circuito.\n\n---\n\n### 5. Recomendaciones para Diferentes Actores Económicos\n\n*   **Para el Gobierno/BCRA:**\n    *   **Objetivo Primario:** Trabajar en políticas que permitan la **unificación cambiaria** y la eliminación de las restricciones. Esto implica:\n        *   **Sostenibilidad Fiscal:** Reducir drásticamente el déficit fiscal y evitar la emisión monetaria para financiarlo.\n        *   **Acuerdo con Organismos Internacionales:** Generar credibilidad para acceder a financiamiento que fortalezca las reservas.\n        *   **Simplificación Regulatoria:** Eliminar cupos y trabas para la compra de divisas.\n    *   **Manejo de la Brecha Azul Negativa:** Investigar sus causas. Si es un problema de oferta, podría necesitarse incentivos para la liquidación formal. Si es de demanda, podría ser una señal de debilidad del mercado informal.\n    *   **Dólar Tarjeta:** Evaluar la carga impositiva actual, considerando su impacto en la inflación y el consumo.\n\n*   **Para Inversores y Ahorristas:**\n    *   **Diversificación:** No depender de un solo tipo de cambio. Entender el riesgo y el costo de cada uno.\n    *   **Cautela ante la Brecha Azul Negativa:** Si bien parece una oportunidad, es una situación atípica. Evaluar si es una tendencia o un evento puntual antes de tomar decisiones grandes.\n    *   **Operaciones \"en Blanco\":** Para resguardar capital de forma legal, los canales Bolsa y CCL (o sus equivalentes en cripto si se gestionan adecuadamente) siguen siendo las opciones a considerar, asumiendo la brecha financiera.\n    *   **Monitoreo Constante:** Seguir de cerca las noticias económicas y las regulaciones cambiarias.\n\n*   **Para Empresas:**\n    *   **Planificación Financiera:** Incorporar escenarios de diferentes cotizaciones en la planificación.\n    *   **Acceso a Divisas:** Priorizar el acceso al dólar oficial/mayorista para importaciones esenciales. Si hay restricciones, evaluar la viabilidad de operar por canales financieros (Bolsa/CCL), considerando los costos.\n    *   **Exportadores:** Evaluar la oportunidad de liquidar en los canales más ventajosos si las regulaciones lo permiten y la brecha azul se mantiene por debajo del oficial.\n    *   **Cobertura de Riesgos:** Utilizar instrumentos financieros disponibles para cubrirse ante la volatilidad cambiaria.\n\n*   **Para Consumidores:**\n    *   **Informarse:** Comprender cuánto cuesta realmente acceder a divisas, especialmente para consumos en el exterior (dólar tarjeta).\n    *   **Ahorro:** Evaluar el riesgo y costo de comprar dólares en el mercado informal si la brecha azul se mantiene atractiva, siempre priorizando la seguridad.\n    *   **Presupuesto:** Ajustar el presupuesto a la realidad de las cotizaciones y la inflación generada por estas brechas.\n\n---\n\nEn resumen, las brechas cambiarias en Argentina son un reflejo directo de las políticas económicas, las restricciones y la confianza del mercado. La actual situación con el dólar blue operando por debajo del oficial es un punto a observar de cerca, mientras que las brechas financieras y del dólar tarjeta señalan la persistencia de la segmentación y los costos asociados a ella. La convergencia de estas brechas solo será posible a través de un programa económico coherente y creíble.\n\nTERMINATE"
  },
  "trends_analysis": {
    "prices_analysis": {
      "oficial": {
        "compra": 1400,
        "venta": 1450,
        "spread": 50,
        "spread_percentage": 3.57
      },
      "blue": {
        "compra": 1420,
        "venta": 1440,
        "spread": 20,
        "spread_percentage": 1.41
      },
      "bolsa": {
        "compra": 1497.4,
        "venta": 1510.6,
        "spread": 13.2,
        "spread_percentage": 0.88
      },
      "contadoconliqui": {
        "compra": 1520.2,
        "venta": 1522.9,
        "spread": 2.7,
        "spread_percentage": 0.18
      },
      "mayorista": {
        "compra": 1415.5,
        "venta": 1424.5,
        "spread": 9.0,
        "spread_percentage": 0.64
      },
      "cripto": {
        "compra": 1514,
        "venta": 1520,
        "spread": 6,
        "spread_percentage": 0.4
      },
      "tarjeta": {
        "compra": 1820,
        "venta": 1885,
        "spread": 65,
        "spread_percentage": 3.57
      }
    },
    "analysis": "Aquí tienes un análisis de las tendencias del mercado cambiario argentino basado en los datos de precios y spreads proporcionados:\n\n## Análisis de Tendencias del Mercado Cambiario Argentino\n\nEste análisis se enfoca en los spreads (la diferencia entre el precio de compra y venta) de las distintas cotizaciones del dólar en Argentina, buscando patrones, factores influyentes, perspectivas y recomendaciones estratégicas.\n\n---\n\n### 1. Análisis de los Spreads entre Compra y Venta\n\nLos spreads (tanto en monto como en porcentaje) reflejan la liquidez y el riesgo percibido en cada segmento del mercado cambiario.\n\n*   **Dólar Oficial:**\n    *   **Spread:** 50 ARS (3.57%).\n    *   **Análisis:** Es el spread nominal más alto, y en porcentaje, es uno de los más significativos (empatado con el dólar tarjeta). Esto indica que, aunque es el mercado más regulado, hay una diferencia considerable entre lo que el sistema bancario paga por comprar y lo que cobra por vender dólares. Puede reflejar costos operativos, regulaciones o una política de gestión activa.\n\n*   **Dólar Blue:**\n    *   **Spread:** 20 ARS (1.41%).\n    *   **Análisis:** El spread es moderado, significativamente menor que el oficial. Esto sugiere que, a pesar de ser un mercado informal, la competencia entre compradores y vendedores mantiene los márgenes relativamente bajos en este momento.\n\n*   **Dólar Bolsa (MEP):**\n    *   **Spread:** 13.2 ARS (0.88%).\n    *   **Análisis:** Es el spread más bajo de todos los mercados financieros. Esto indica alta liquidez y eficiencia en este canal. El bajo spread en un mercado que opera por encima del oficial sugiere que la operativa es fluida y con pocos intermediarios, reduciendo los costos de transacción.\n\n*   **Contado con Liquidación (COLCAP):**\n    *   **Spread:** 2.7 ARS (0.18%).\n    *   **Análisis:** **Este es el spread más bajo de todos los mercados, casi inexistente.** Refleja una operativa muy eficiente y competitiva, probablemente impulsada por la demanda de giro de divisas al exterior y la participación de actores financieros sofisticados.\n\n*   **Dólar Mayorista:**\n    *   **Spread:** 9.0 ARS (0.64%).\n    *   **Análisis:** Un spread bajo, indicando transacciones de gran volumen y costos de intermediación reducidos. Es un mercado profesional y líquido.\n\n*   **Dólar Cripto:**\n    *   **Spread:** 6 ARS (0.4%).\n    *   **Análisis:** Un spread bajo, comparable al del dólar mayorista y COLCAP, pero superior a este último. Indica una liquidez razonable en las plataformas de intercambio de criptomonedas.\n\n*   **Dólar Tarjeta:**\n    *   **Spread:** 65 ARS (3.57%).\n    *   **Análisis:** El spread nominal más alto y, en porcentaje, empata con el dólar oficial. Este spread es en gran parte una consecuencia de los impuestos y recargos aplicados sobre la cotización base, lo que refleja el costo total de la transacción para el consumidor.\n\n---\n\n### 2. Identificación de Patrones en las Cotizaciones\n\n*   **Segmentación Clara:** Los datos confirman una marcada segmentación del mercado. El dólar oficial y el mayorista operan a un nivel, mientras que los mercados financieros (Bolsa, CCL, Cripto) lo hacen a un nivel superior (premium), y el dólar tarjeta se sitúa muy por encima de todos debido a impuestos. El dólar blue presenta la anomalía de estar por debajo del oficial.\n*   **Liquidez y Eficiencia:** Los mercados financieros (COLCAP, Bolsa, Cripto, Mayorista) muestran spreads porcentuales muy bajos, indicando alta liquidez y eficiencia operativa. El COLCAP es el más eficiente.\n*   **Costo para el Usuario Final:** El dólar tarjeta es, por lejos, el más caro para el consumidor final, debido a su carga impositiva y su spread nominal.\n*   **Comportamiento del Blue:** La anomalía del dólar blue por debajo del oficial sugiere una situación coyuntural de sobreoferta o baja demanda en el mercado informal, lo que podría ser temporal. Tradicionalmente, se espera que opere por encima del oficial.\n*   **Tendencia General:** Si asumimos que la cotización oficial de venta (1450 ARS) es un punto de referencia \"artificial\", los mercados de libre oferta y demanda (Bolsa, CCL, Cripto) se mueven con márgenes más estrechos entre sí, reflejando el \"precio de mercado\" más cercano a la realidad económica sin regulaciones.\n\n---\n\n### 3. Factores que Influyen en las Tendencias\n\n*   **Política Monetaria y Fiscal:**\n    *   **Emisión Monetaria y Déficit Fiscal:** Tienden a presionar al alza las cotizaciones de todos los dólares de mercado (Bolsa, CCL, Cripto, Blue si la emisión genera inflación y desconfianza).\n    *   **Tasas de Interés:** Tasas de interés altas en pesos pueden desalentar la compra de dólares, pero si la inflación es mayor, la demanda de cobertura persiste.\n    *   **Reservas del BCRA:** La disponibilidad de divisas para intervenir en el mercado oficial y, secundariamente, influir en otros mercados.\n*   **Regulaciones Cambiarias:** Las restricciones para acceder al dólar oficial impulsan la demanda de los mercados paralelos y financieros, manteniendo las brechas positivas. La eliminación de estas restricciones sería clave para la convergencia.\n*   **Confianza y Expectativas:**\n    *   **Incertidumbre Política/Económica:** Aumenta la demanda de cobertura, elevando las cotizaciones de mercado y las brechas.\n    *   **Expectativas de Devaluación:** Si se anticipa una devaluación fuerte, los precios del dólar tienden a subir.\n*   **Flujos de Capitales:** El ingreso o egreso de divisas por inversiones, comercio exterior o pago de deuda impacta la oferta y demanda.\n*   **Dinámica de Oferta y Demanda en Mercados Específicos:**\n    *   **Dólar Blue:** Oferta de personas físicas, demanda de ahorro en efectivo.\n    *   **Mercados Financieros:** Demanda de cobertura, inversión, pago de servicios/dividendos. Oferta de liquidación de exportaciones.\n    *   **Dólar Tarjeta:** Demanda de consumo en el exterior y política impositiva.\n*   **Naturaleza del Spread:**\n    *   **Spreads Bajos (COLCAP, Bolsa):** Alta liquidez, competencia, operación en blanco.\n    *   **Spreads Altos (Oficial, Tarjeta):** Regulación, costos operativos, impuestos, menor liquidez o intervención activa.\n\n---\n\n### 4. Perspectivas a Corto y Mediano Plazo\n\n*   **Corto Plazo:**\n    *   **Persistencia de Brechas:** Es probable que las brechas financieras (Bolsa, CCL, Cripto) se mantengan positivas mientras existan restricciones al acceso al dólar oficial.\n    *   **Comportamiento del Blue:** La brecha negativa del dólar blue es inusual. Podría ser un reflejo de una intervención puntual, una sobreoferta de liquidez en el mercado informal, o una señal de que las expectativas de devaluación a corto plazo se han moderado significativamente en ese segmento. Si las condiciones que la generan persisten, podría achicar la brecha con el oficial e incluso superarlo. Si es coyuntural, podría volver a operar por encima del oficial.\n    *   **Dólar Tarjeta:** Se mantendrá como la opción más cara mientras continúen los impuestos actuales.\n    *   **Volatilidad:** El mercado seguirá siendo volátil, sensible a noticias económicas, políticas y a la evolución de las reservas.\n\n*   **Mediano Plazo:**\n    *   **Convergencia Cambiaria:** La tendencia a mediano plazo dependerá crucialmente de la capacidad del gobierno para implementar un plan económico sostenible que reduzca la inflación, sanee las cuentas públicas y genere confianza. Solo así se podrá avanzar hacia una unificación cambiaria y achicar las brechas.\n    *   **Impacto de Políticas:** Cualquier cambio significativo en las políticas económicas (ej. eliminación de impuestos, libre acceso al dólar oficial, reducción del déficit) podría acelerar la convergencia o, por el contrario, generar nuevas divergencias si no se ejecutan de manera creíble.\n    *   **El Rol del Blue:** La persistencia de su cotización por debajo del oficial requeriría un análisis profundo; si se mantiene, podría ser un indicador de cambios en la dinámica de oferta/demanda o un factor que impulse ajustes en otros mercados.\n\n---\n\n### 5. Recomendaciones Estratégicas\n\n*   **Para Inversores y Ahorristas:**\n    *   **Estrategia Basada en Objetivos:**\n        *   **Resguardo de Capital \"en blanco\" y liquidez:** Dólar Bolsa y COLCAP (con spreads bajos) son eficientes. Evaluar la relación riesgo/beneficio y las regulaciones.\n        *   **Dólar Físico (ahorro):** Dada la peculiaridad actual del dólar blue por debajo del oficial, monitorear su comportamiento. Si la situación se normaliza con el blue por encima del oficial, el spread más bajo en el mercado financiero lo haría preferible para operaciones de mayor volumen.\n        *   **Consumo en el Exterior:** Asumir que el dólar tarjeta es el costo real. Planificar viajes y gastos en función de este valor.\n    *   **Diversificación:** No concentrar activos en un solo tipo de cambio.\n    *   **Educación Financiera:** Entender las implicancias de cada cotización y sus riesgos.\n\n*   **Para Empresas:**\n    *   **Optimización de Costos:** Para importaciones, evaluar el acceso al dólar oficial/mayorista. Para pagos en el exterior, el COLCAP puede ser eficiente si se cumplen las regulaciones.\n    *   **Cobertura de Riesgos:** Utilizar instrumentos financieros (si están disponibles y son accesibles) para mitigar la volatilidad de las brechas.\n    *   **Análisis de Brechas:** Incluir los spreads en el análisis de rentabilidad y costos de las operaciones. Un spread bajo en COLCAP o Bolsa indica mayor previsibilidad en el costo de las divisas para operaciones financieras.\n    *   **Seguimiento de Regulaciones:** Estar atentos a cualquier cambio en las normativas que pueda afectar la operativa en los distintos mercados.\n\n*   **Para el Gobierno/BCRA:**\n    *   **Simplificar y Unificar:** El objetivo principal debería ser la convergencia de las cotizaciones. Esto requiere una política macroeconómica coherente (fiscal, monetaria y cambiaria).\n    *   **Reducir Spreads Artificiales:** Los spreads altos en el dólar oficial y tarjeta se deben, en parte, a políticas. Evaluar si estos spreads cumplen su objetivo o generan distorsiones excesivas.\n    *   **Fomentar la Liquidez en Mercados Eficientes:** Mantener las condiciones que permiten los bajos spreads en Bolsa, CCL y Cripto (si se opera legalmente) puede ser útil para la canalización de fondos \"en blanco\".\n    *   **Investigar el Comportamiento del Blue:** Comprender la causa de su cotización inferior al oficial para poder actuar de manera informada y evitar que genere distorsiones mayores.\n\nEn conclusión, el mercado cambiario argentino presenta una dinámica compleja marcada por la segmentación, la influencia de regulaciones y la búsqueda de eficiencia en los canales de libre operatoria. Los bajos spreads en mercados como el COLCAP y Bolsa reflejan una operatividad eficiente, mientras que los spreads altos en el oficial y tarjeta señalan la presencia de regulaciones y/o altos costos de transacción. La tendencia a corto plazo sugiere la persistencia de brechas, mientras que la convergencia a mediano plazo dependerá de la implementación de políticas económicas sólidas.\n\nTERMINATE"
  },
  "summary": "Aquí tienes un resumen ejecutivo del análisis de cotizaciones del dólar en Argentina:\n\n**Resumen Ejecutivo: Mercado Cambiario Argentino**\n\nEl mercado cambiario argentino presenta una notable segmentación. El dólar oficial (venta: 1450 ARS) es el punto de referencia regulado, pero cotizaciones alternativas muestran diferencias significativas. El dólar blue (venta: 1440 ARS) se encuentra anómalamente por debajo del oficial, sugiriendo una sobreoferta o baja demanda temporal en el mercado informal. Por otro lado, los dólares financieros como el Bolsa (venta: 1510.6 ARS), Contado con Liquidación (venta: 1522.9 ARS) y Cripto (venta: 1520 ARS) operan con un \"premium\" respecto al oficial, reflejando la demanda de cobertura y las restricciones de acceso al mercado formal. El dólar Tarjeta (venta: 1885 ARS) es, con diferencia, el más costoso debido a impuestos, actuando como un tipo de cambio de alto recargo. Los spreads en los mercados financieros son muy bajos, indicando alta liquidez y eficiencia.\n\nLas conclusiones principales apuntan a que las brechas cambiarias persisten debido a las regulaciones y la desconfianza económica, aunque la dinámica del dólar blue es inusual. El dólar Tarjeta representa el costo real para el consumo en el exterior. Para inversores, los canales financieros ofrecen eficiencia pero a un precio superior al oficial; para consumidores, el dólar blue presenta una oportunidad atípica de compra física, mientras que el Tarjeta implica un alto costo. Las perspectivas a corto plazo sugieren volatilidad y la posible persistencia de las brechas, a menos que haya cambios significativos en las políticas económicas.\n\nLas recomendaciones estratégicas varían: para inversores, diversificar y operar en canales eficientes según su objetivo; para empresas, optimizar costos y cobertura cambiaria; y para el gobierno, trabajar en la unificación cambiaria y la reducción de brechas mediante políticas macroeconómicas sostenibles. Se aconseja monitorear de cerca la evolución del dólar blue y las políticas que puedan impactar en la convergencia de las cotizaciones.\n\nTERMINATE"
}